event_id,name,event_date,start,end,support_level
AFG2009,Afghanistan troop surge (2009),2009-12-01,2009-11-17,2009-12-22,high
PAK2011,Osama bin Laden raid (2011),2011-05-02,2011-04-22,2011-05-16,high
LBY2011,Libya intervention (2011),2011-03-19,2011-03-09,2011-04-09,low
SYR2013,Syria chemical weapons crisis (2013),2013-08-21,2013-08-11,2013-09-11,low
IRQ2014,First U.S. airstrikes on ISIS (2014),2014-08-08,2014-07-29,2014-08-29,high
IRQ2016,Battle for Mosul offensive (2016),2016-10-17,2016-10-07,2016-11-07,high
SYR2017,Syria Shayrat airbase strike (2017),2017-04-07,2017-03-28,2017-04-21,low
SYR2018,Syria Douma chemical attack response (2018),2018-04-14,2018-04-04,2018-04-28,low
